{
  "format": "fgpm.package/2",
  "namespace": "6d7092e8-6f8a-4e25-bb6e-a0bf6588e5b4",
  "name": "demo.scene-extractor-v2",
  "version": "0.8.0",
  "license": "Apache-2.0",
  "dependencies": [
    {
      "package": "demo.runtime-instance-store",
      "range": "^0.6.0"
    },
    {
      "package": "demo.transform-authority",
      "range": "^0.7.0"
    },
    {
      "package": "demo.save-coordinator",
      "range": "^0.7.0"
    },
    {
      "package": "demo.deterministic-scheduler-v2",
      "range": "^0.8.0"
    }
  ],
  "runtimeServices": [
    {
      "id": "service:demo.scene-extractor-v2/1",
      "protocol": "fgpm.runtime-service/2",
      "provides": [
        {
          "capability": "runtime.scene-snapshot",
          "version": "1.0.0",
          "cardinality": "exclusive"
        }
      ],
      "requires": [
        {
          "capability": "runtime.instances.read",
          "range": "^1.0.0",
          "cardinality": "exclusive",
          "binding": "runtime.instances/1"
        },
        {
          "capability": "runtime.transforms.read",
          "range": "^1.0.0",
          "cardinality": "exclusive",
          "binding": "runtime.transforms/1"
        },
        {
          "capability": "runtime.scheduler.barrier",
          "range": "^2.0.0",
          "cardinality": "exclusive",
          "binding": "runtime.scheduler/2"
        },
        {
          "capability": "runtime.restore.ready",
          "range": "^1.0.0",
          "cardinality": "exclusive",
          "binding": "runtime.persistence/1"
        }
      ],
      "artifactAccess": "none",
      "artifactStoreAccess": "none",
      "hostGrants": [],
      "execution": {
        "form": "native-in-process",
        "securityBoundary": "none",
        "requestedPowers": []
      },
      "module": "service.mjs",
      "activationContract": "activation.json"
    }
  ]
}
